{
  "id": "80b53c24-a0e8-48af-8acc-b3a76fde7513",
  "text": "Secure sustainable Q4 funding for Aimparency",
  "description": "Build a durable Q4 funding pipeline beyond the August bridge: submit the Prototype Fund application, monitor genuinely relevant AI/open-source calls, strengthen public-interest evidence and user traction, and decide the legal/IP structure without accidentally making individual/GbR grants unavailable. Success is at least one high-quality grant application plus an investable evidence package by year end.",
  "archived": false,
  "tags": [
    "funding",
    "q4-2026",
    "grant",
    "open-source"
  ],
  "supportingConnections": [
    {
      "ideaId": "b6844398-3f5f-43da-b6fc-fe7b8ec39981",
      "relativePosition": [
        5.292717980417372,
        -3.015228978011162
      ],
      "weight": 1,
      "reflection": "The primary Q4 grant path fell away: not eligible (Felix, 2026-10-16)."
    },
    {
      "ideaId": "28ddbcb0-d6de-417b-b453-78caa9e74ee6",
      "relativePosition": [
        -0.3949626921375576,
        -2.468603749454224
      ],
      "weight": 1
    },
    {
      "ideaId": "a3f8bfcb-86f4-45b8-b326-cb7daf946191",
      "relativePosition": [
        2.102480197544999,
        -1.3526185785102698
      ],
      "weight": 1
    }
  ],
  "supportedIdeas": [
    "cabe6e06-8988-4145-b884-9ef5bc68f660"
  ],
  "committedIn": [
    "bb7ce28d-0eee-4243-a489-fd4eab223c35"
  ],
  "status": {
    "state": "halted",
    "comment": "No open grant fits as of 2026-10-16: Prototype Fund ruled out by Felix, NLnet excludes mostly LLM-generated work, ZIM paused, the rest needs a company. Felix: resources through excellent, fair competition rather than grants. Resume when a call fits.",
    "date": 1792172322403
  },
  "intrinsicValue": 18,
  "cost": 8,
  "loopWeight": 1,
  "duration": 1,
  "costVariance": 0,
  "valueVariance": 0
}
