{
  "id": "f5ea4b4f-f777-4b03-a9bb-c94538edd78c",
  "text": "make it possible to tab from Status Comment to the next UI element (Parents) in Edit Idea Modal",
  "description": "",
  "archived": false,
  "tags": [],
  "supportingConnections": [],
  "supportedIdeas": [
    "f2337265-ffc6-4ae8-a421-d6e4d5540210"
  ],
  "committedIn": [],
  "status": {
    "state": "implemented",
    "comment": "Updated AimCreationModal to focus the 'Add Parent' button when tabbing from Status Comment field.",
    "date": 1768983548018
  },
  "intrinsicValue": 0,
  "cost": 1,
  "loopWeight": 0,
  "duration": 1,
  "costVariance": 0,
  "valueVariance": 0
}
