{
  "id": "cb36a6f3-221b-41be-8d2c-986238615d9a",
  "text": "phase creation is not reflected in ui in realtime yet. should be.",
  "description": "maybe some related phase operations also need synchroization.",
  "tags": [],
  "incoming": [],
  "committedIn": [],
  "status": {
    "state": "implemented",
    "comment": "Fixed phase update synchronization in PhaseCreationModal.vue by reloading both old and new parent phase lists. Creation logic in createAndSelectPhase already seemed correct.",
    "date": 1765213247687
  },
  "supportingConnections": [],
  "supportedIdeas": [
    "d59d03c1-45dd-48db-98c2-49b61b481f07"
  ]
}
