{
  "id": "8419f493-e9ee-4917-b858-32bdbb0b2dca",
  "text": "Fix real-time synchronization for floating ideas so they appear automatically in the web client",
  "tags": [],
  "incoming": [],
  "committedIn": [
    "ab939925-1be6-43fc-b7a9-958b49b2c66a"
  ],
  "status": {
    "state": "implemented",
    "comment": "Modified packages/frontend/src/stores/data.ts to update floatingIdeasIds when a new idea event is received via WebSocket. Also fixed a missing type import in packages/backend/src/server.ts. Verified with type-check.",
    "date": 1765316000000
  },
  "supportingConnections": [
    {
      "ideaId": "a857ae19-b7eb-48f8-a3bf-7faa69f5dd3a",
      "relativePosition": [
        4.365279705617022,
        -2.9828799723045676
      ],
      "weight": 1
    }
  ],
  "supportedIdeas": []
}
