{
  "id": "a1f62047-5be3-4178-9274-3e060285fd29",
  "text": "Gate idea 'done' on verification evidence appropriate to the idea type",
  "description": "For the idea graph to be a trustworthy compass, 'done' must mean verified-done, not claimed-done. Observed repeatedly that ideas get closed on weak evidence: a UI-jitter idea closed by git archaeology (visual bug, never seen running), a 'session reflection' idea where the live code path was actually dead. The loop should require + record evidence matched to the idea type before status=done — code: tests/typecheck pass; UI/visual: screenshot or interaction proof; behavior/bugfix: a repro that now passes — captured in the reflection. Complements c0a45822 (grounding VALUE in outcomes) by grounding STATUS in evidence. Without it, more autonomy compounds confident-but-unverified work (drift) rather than capability — the core risk on any path to ASI.",
  "archived": false,
  "tags": [],
  "supportingConnections": [],
  "supportedIdeas": [
    "2b76f62f-3f7b-42f0-ab2e-b571dabf2ca5"
  ],
  "committedIn": [
    "93180fe9-3a1f-4778-9343-1b1de0f2bca6"
  ],
  "status": {
    "state": "cancelled",
    "comment": "Deprioritized 2026-07-22 after Felix clarified this evidence-gate initiative was not his idea and redirected effort toward real customers, funding, talks, and human leverage. Existing generic verification guidance remains; no richer gate will be built under this idea.\n\nCorrected attribution and priority after direct founder feedback. I had selected this agent-originated partial idea as if it represented Felix's intent. It does not. Stopped work before making code changes and redirected the loop to human-leverage actions with real external feedback.",
    "date": 1784740628382
  },
  "intrinsicValue": 0,
  "cost": 3,
  "loopWeight": 1,
  "duration": 1,
  "costVariance": 0,
  "valueVariance": 0
}
