{
  "id": "541a9365-8d41-4835-aab7-823f5807b6fb",
  "text": "Reflection pattern: Periodic self-evaluation",
  "description": "Implement reflection loop from education/005.\n\nTrigger reflection:\n- After completing each idea (immediate)\n- End of each work session (periodic)\n- Every N hours of active work (time-based)\n\nReflection prompt:\n```\nReflect on your recent work:\n1. Context: What were you trying to achieve?\n2. Outcome: What actually happened?\n3. Effectiveness: How well did your approach work?\n4. Lesson: What would you do differently next time?\n5. Pattern: Does this relate to past experiences?\n```\n\nStore as:\n- New field in idea schema: `reflections: Reflection[]`\n- OR separate `.bowman/reflections/` directory\n- Link to ideas worked on\n\nUse reflections:\n- Inform strategy adjustments\n- Build pattern library\n- Improve future work quality",
  "archived": false,
  "tags": [
    "asi",
    "reflection",
    "learning",
    "self-improvement"
  ],
  "supportingConnections": [],
  "supportedIdeas": [
    "69321b93-d540-45a9-9a25-8f2d5254d43c"
  ],
  "committedIn": [
    "618b92d0-70cc-434c-b2b5-ee9fcfefc25a"
  ],
  "status": {
    "state": "implemented",
    "comment": "Implemented reflection pattern: (1) Extended Idea schema with Reflection type and reflections array in shared/types.ts, (2) Added addReflection tRPC endpoint in backend/routers/idea.ts, (3) Updated all idea creation points to initialize reflections: [], (4) Fixed frontend type errors in list-store.ts, (5) Updated INSTRUCT.md with reflection guidance (when/how to reflect), (6) Added addReflection MCP tool in mcp/tools.ts, (7) Built all packages. Infrastructure complete - agents can now record structured reflections on completed ideas.",
    "date": 1772128769867
  },
  "intrinsicValue": 0,
  "cost": 1,
  "loopWeight": 1,
  "duration": 1,
  "costVariance": 0,
  "valueVariance": 0
}
