{
  "id": "891e2ee0-9df6-49f0-9b97-c62a19e29456",
  "text": "Decide UI approach for ideas with multiple parents in phase view",
  "description": "**HUMAN DECISION REQUIRED:**\n\n**Context:**\nIdea a05ea545 proposes: \"When an idea with a parent is shown at the first level of a phase, prepend ~20 chars from parent title + / to provide context.\"\n\n**Problem:**\nIdeas can have multiple parents in the graph. The current proposal doesn't specify how to handle this.\n\n**Options:**\n1. **Pick first parent** - Use alphabetically first or oldest parent idea\n2. **Pick most relevant parent** - Use parent that's also committed to the same phase (if any)\n3. **Show multiple prefixes** - \"Parent1/Parent2/Idea Title\" (could get long)\n4. **Skip multi-parent ideas** - Only add prefix when idea has exactly one parent\n5. **Different approach entirely** - Maybe use tooltips, icons, or indentation instead of prefix\n\n**Decision needed:**\nWhich option makes the most UX sense? Or should we abandon this feature entirely if multi-parent handling is too complex?\n\nHUMAN GUIDANCE: \nin idea search, let's introduce navigation feature: \nh shows list of supported ideas, l shos list of supporting ideas. This is relevant, because sometimes we find an idea but then want to select one of it's children. \n\nReady to implement.",
  "archived": false,
  "tags": [],
  "supportingConnections": [
    {
      "ideaId": "855e26a1-695b-4b8f-bd73-e3f441a53111",
      "relativePosition": [
        2.138791361467999,
        0.9960125558972831
      ],
      "weight": 1
    }
  ],
  "supportedIdeas": [
    "a05ea545-0395-4e9a-941f-159ca60c60e1"
  ],
  "committedIn": [],
  "status": {
    "state": "implemented",
    "comment": "Resolved via implementation of h/l navigation and path merging in search.\n\nOutcome: Implemented a navigation-based approach with automated suffix merging for redundant paths. Effectiveness: The decision to use navigation paths and merge common suffixes effectively solves the 'too much noise' problem of multiple parents. Lesson: Interactive exploration (h/l) is often better than trying to cram all relational context into a single static label.",
    "date": 1778797628927
  },
  "intrinsicValue": 0,
  "cost": 1,
  "loopWeight": 1,
  "duration": 1,
  "costVariance": 0,
  "valueVariance": 0
}
