{
  "id": "13d86789-3114-4de3-b444-2899fb3fc845",
  "text": "shift / ctrl + click on computer, long tap on touch/android for selecting multiple ideas in list view",
  "description": "Multi-selection gestures specifically in the recursive list/column view: desktop modifier-click and mobile long-press, using shared selection state.",
  "archived": false,
  "color": null,
  "tags": [],
  "supportingConnections": [],
  "supportedIdeas": [
    "887a6cd5-458f-4ba2-b91f-b0291a0ff66c",
    "b3d98c5b-8ba0-4910-9745-d778795e9c51"
  ],
  "committedIn": [],
  "status": {
    "state": "review",
    "comment": "Desktop modifier/range selection and list-view touch long-press are implemented; awaiting user acceptance.\n\nList long-press now toggles shared multi-selection before opening the action menu. Focused Idea and list-store tests pass (9/9); frontend production build passes.",
    "date": 1784493390092
  },
  "intrinsicValue": 0,
  "cost": 1,
  "loopWeight": 1,
  "duration": 1,
  "costVariance": 0,
  "valueVariance": 0
}
