{
  "id": "82bfb523-b32c-4757-9526-290a93a4e7c0",
  "text": "Fix backend test harness: vitest-based suites fail under node --test runner",
  "description": "packages/backend `npm test` (NODE_ENV=test node scripts/run-tests.mjs) runs the suites through node --test/tsx, but src/*.test.ts import from 'vitest' (db, server, forces, embeddings, value-calculation). Result: 5/6 files fail with \"Vitest failed to find the runner\" — independent of any source change (reproduces at HEAD). Either run these via `vitest` (add vitest config + script) or migrate the imports to node:test (as shared/ already uses). Until fixed, verify backend logic via `tsx --test` per-suite + `tsc --noEmit`. Discovered 2026-05-31 while landing the connection contribution-% feature.",
  "archived": false,
  "tags": [
    "testing",
    "tooling",
    "backend",
    "tech-debt"
  ],
  "supportingConnections": [],
  "supportedIdeas": [
    "8ad3d334-7b71-4068-98b0-0e860ccf0d31"
  ],
  "committedIn": [
    "6a3432ea-a0c5-4df4-b533-68298be7b7fc"
  ],
  "status": {
    "state": "implemented",
    "comment": "Fixed: backend `test` script now runs `NODE_ENV=test vitest run` (was tsx --test via run-tests.mjs); declared vitest as a backend devDependency (^4.1.8, previously only hoisted at root); removed the orphaned scripts/run-tests.mjs. Verified: npm test -w backend → 6 files / 31 tests pass. Added test:watch too.\n\nOutcome: Pointed the script at `vitest run` (vitest was already hoisted at root and passing), declared vitest as a backend devDep, and deleted the dead runner. npm test -w backend now passes 31/31. Effectiveness: Minimal, correct fix — the tests were never broken, only the runner was wrong. Declaring the dep removes reliance on accidental hoisting. Lesson: When a wrapper script looks broken, check whether the tool is merely invoked the wrong way before assuming the tests themselves are at fault. Also: this idea sat at priority -1.0 purely from value-graph disconnection, not low worth — a reminder that priority misranks infra/tooling lacking an intrinsic-value ancestor. Pattern: Same diagnosis-before-rewrite approach as the connection-feature verification; small infra fixes often just need the right invocation.",
    "date": 1780306704548
  },
  "intrinsicValue": 0,
  "cost": 1,
  "loopWeight": 1,
  "duration": 1,
  "costVariance": 0,
  "valueVariance": 0
}
