{
  "id": "c71bb0e6-9822-49a3-83dd-d6e6d0649433",
  "text": "configure e2e tests to run headless",
  "description": "",
  "archived": false,
  "tags": [],
  "supportingConnections": [],
  "supportedIdeas": [],
  "committedIn": [
    "f51f8930-c937-4c66-9db8-d4d313e6d286"
  ],
  "status": {
    "state": "implemented",
    "comment": "Configured playwright.config.ts to run headless by default (unless HEADED=true). Verified with test run.",
    "date": 1766145000000
  },
  "intrinsicValue": 0,
  "cost": 1,
  "loopWeight": 1,
  "duration": 1,
  "costVariance": 0,
  "valueVariance": 0
}
