{
  "id": "f919dfba-61d5-488d-aed5-c14a953c4b6c",
  "text": "implement a get sub ideas",
  "description": "",
  "tags": [],
  "incoming": [],
  "committedIn": [],
  "status": {
    "state": "implemented",
    "comment": "Implemented via 'list-ideas' tool with 'parentIdeaId' parameter in MCP and backend support.",
    "date": 1765401625091
  },
  "supportingConnections": [],
  "supportedIdeas": [
    "97d2e473-64b4-4de8-99c8-d8a7a064ee43"
  ]
}
