{
  "id": "2694247d-43d6-4402-86f6-2b787e51f9a3",
  "text": "Update Frontend Logic for supportingConnections",
  "tags": [
    "frontend",
    "refactor"
  ],
  "incoming": [],
  "committedIn": [],
  "status": {
    "state": "implemented",
    "comment": "Updated frontend logic (stores/data.ts, components/Idea.vue) to use 'supportingConnections'. Implemented fallback for backward compatibility during migration.",
    "date": 1765571840292
  },
  "supportingConnections": [],
  "supportedIdeas": [
    "b439cf5f-d9b8-4406-a73b-65236c321c91"
  ]
}
