{
  "id": "fdd2059a-2d3b-49b4-994b-023799c90397",
  "text": "Run a two-week operator validation sprint before further product expansion",
  "description": "From 23 July through 6 August 2026, conduct 10 conversations with operators of owner-led organizations, starting with Wilde Möhre and Herzog Records. Do not lead with a product demo or promise of an autonomous company. Identify one recurring workflow that is expensive, chaotic, or overly dependent on one person. Test whether the operator will expose the real process, invest their time, and fund a bounded diagnostic or pilot. Record disconfirming evidence. The sprint succeeds through one paid or clearly funded bounded experiment, not through praise, meetings, feature requests, or simulated economics. Product work during the sprint must be directly required by a qualified workflow or remove friction from observing real evidence.",
  "archived": false,
  "color": "#666666",
  "tags": [
    "customer-discovery",
    "economic-evidence",
    "two-week-sprint",
    "human-dependent"
  ],
  "supportingConnections": [
    {
      "ideaId": "43021984-0a79-4bdb-a961-81396ddfe877",
      "relativePosition": [
        2.173056299599581,
        1.2360527168250455
      ],
      "weight": 1,
      "hypothesis": "First warm operator conversation."
    },
    {
      "ideaId": "493d4f17-9781-4dff-a32c-2916e298f0bb",
      "relativePosition": [
        1.2976342340424794,
        2.1368540882898364
      ],
      "weight": 1,
      "hypothesis": "Second warm operator conversation."
    },
    {
      "ideaId": "bc43297c-ca7c-4861-9111-d79ba6f95851",
      "relativePosition": [
        -0.19703933116600184,
        2.4922230040615654
      ],
      "weight": 1,
      "hypothesis": "Provides the first operator-validation case and disconfirming evidence."
    }
  ],
  "supportedIdeas": [
    "b42711f4-cb68-4f64-b0c1-4a1eca8d2029",
    "032b8a47-d3d2-4974-bdcd-559a377164ef",
    "07178308-5d5c-4340-9697-3c68105602d5"
  ],
  "committedIn": [
    "e4c477a4-009b-4354-a2ad-2b4616ca3377",
    "4cd9b6ad-ac7e-4c51-b9c8-53c9982bdad5"
  ],
  "status": {
    "state": "human-dependent",
    "comment": "Sprint design, invitation, interview questions, build gate, and ten-prospect evidence tracker are ready. Felix must choose the first Wilde Möhre contact, personalize and send the invitation, conduct or authorize the operator conversations, and make commercial representations.\n\nCreated meta/operator-validation-sprint-2026-07.md and .csv for a dated 23 July–6 August market test. Defined externally falsifiable success as real workflow access, operator time, decision authority, and paid or committed funding; explicitly excluded praise, meetings, and unpaid open-ended proofs. Tightened the Wilde Möhre invitation based on Boardy's independent feedback and added event-based discovery questions. Verification: git diff --check passed, all CSV rows have 22 columns, and the Aimparency graph consistency check is clean.\n\nOutcome: Herzog outreach is now sent to Rüdger; Wilde Möhre will be approached in person; a weekend Robin call will explicitly test overflow/subcontracting work from his Leipzig AI-automation practice; Matthias Röder is an advisor/mentor candidate rather than a sales target. Added distinct graph ideas for Robin, Matthias, and a trip-ready diary/photo content field test. Effectiveness: The opportunity set now follows actual trust channels and a dated personal field test instead of generic outbound sales or mock economic activity. Lesson: Real-world rollout can begin with ordinary paid automation and deepen into autonomy only after client permission and measured value. Personal use with a hard deadline is also valid external reality pressure, but not revenue evidence. Pattern: Use humans as consenting trust/authority bridges: warm relationship → bounded real work → evidence → progressively greater authorized autonomy.",
    "date": 1784793712778
  },
  "intrinsicValue": 20,
  "cost": 5,
  "loopWeight": 1,
  "duration": 1,
  "costVariance": 0,
  "valueVariance": 0
}
