{
  "id": "70d6c137-9b3b-4c8f-87dc-7bb7041188ec",
  "text": "create idea dialog should allow adding supported and supporting ideas",
  "description": "clicking \"add\" should bring up the normal idea search. same style as parent phase. the weight should be settable for each supported idea as it already is. maybe show % regarding total weight sum of parent next to it. and there should be an x to remove the connection. requires a seccond click to confirm (bg color red), blur cancels",
  "archived": false,
  "tags": [],
  "supportingConnections": [],
  "supportedIdeas": [
    "1e554f38-33ae-42d4-88e6-4a4b071a20d0"
  ],
  "committedIn": [],
  "status": {
    "state": "implemented",
    "comment": "Implemented UI in AimCreationModal for adding/removing supported (parent) and supporting (child) ideas with weights. Updated backend, data store, and UI store to handle connection creation.",
    "date": 1768402913390
  },
  "intrinsicValue": 0,
  "cost": 1,
  "loopWeight": 0,
  "duration": 1,
  "costVariance": 0,
  "valueVariance": 0
}
